4|40|Płatki śniadaniowe i Musli|Kupiec Coś na ząb Owsianka naturalna|1,69|50 g|https://e-szop24.pl/photos/021308_kupowsianka_nat_50g_bb1.png
4|40|Jogurty i Serki i Desery|Bakoma jogurt premium wiśnia|1,55|140g|https://e-szop24.pl/photos/011075_bakoma_jog_pre_wis_bb1.png
4|40|Dezodoranty|Old Spice Original Woda po goleniu|36,60|100 ml|https://e-szop24.pl/photos/028618_old_spi_ori_wod_po_gol_bb1.png
4|40|Kawa mielona i Ziarnista|Woseba Arabica Kawa palona ziarnista|27,99|500 g|https://e-szop24.pl/photos/019580_woseba_ara_kaw_pal_zia_bb1.png
4|40|Dodatki do wypieków|Dr. Oetker Barwnik spożywczy zielony|4,24|10 g|https://e-szop24.pl/photos/020069_dr_oet_bar_spo_zie_bb1.png
4|40|Paluszki i Ciastka|Balviten Paluszki z sezamem|7,99|70 g|https://e-szop24.pl/photos/023988_balpaluszki_sez_bez_bb1.png
4|40|Kawa rozpuszczalna|Davidoff fine kawa rozpuszczalna|34,99|100 g|https://e-szop24.pl/photos/015176_davidoff_fin_kaw_roz_bb1.png
4|40|Cukierki|Haribo żelki happy-cola|3,97|100g|https://e-szop24.pl/photos/013676_haribo_zel_hap_col_bb1.png
4|40|Pielęgnacja twarzy|Nivea Tonik matujący|16,99|200 ml|https://e-szop24.pl/photos/017646_nivea_ton_mat_bb1.png